Título;Sala;Fecha;Hora;Más información;Programa;Precio;Imagen
Excelentia. Quinta de Beethoven & Violonchelo de Dvo?ák;Sala Sinfónica;2025-02-18;19:30:00+01:00;https://www.auditorionacional.mcu.es/es/programacion/excelentia-quinta-de-beethoven-violonchelo-de-dvorak;"Orquesta Clásica Santa Cecilia
Juan Pablo Valencia Director
Santiago Cañón-Valencia Violonchelo

Rossini Guillermo Tell, obertura
Dvo?ák Concierto para violonchelo y orquesta
Beethoven Sinfonía núm. 5";78, 74, 72, 68, 56, 52, 48, 46 y 42 €;https://www.auditorionacional.mcu.es/es/programacion/excelentia-quinta-de-beethoven-violonchelo-de-dvorak/@@images/8476ed56-ffb0-4b16-9efa-d008a0d3eadd.jpeg
Excelentia. Carmina Burana;Sala Sinfónica;2025-02-20;19:30:00+01:00;https://www.auditorionacional.mcu.es/es/programacion/excelentia-carmina-burana-5;Sociedad Coral Excelentia de Madrid Orquesta Clásica Santa Cecilia Director, Kynan Johns Veriko Tchumburidze, violín Rocío Martínez, soprano Manuel Más, barítono Respighi: Concierto Gregoriano Orff: Carmina Burana;78, 75, 72, 68, 64, 58 y 44 €;https://www.auditorionacional.mcu.es/es/programacion/excelentia-carmina-burana-5/@@images/6216d96c-408f-4170-86e7-5347687fb859.jpeg
"CNDM.Alfredo Rodríguez Trio ""Coral Way""";Sala de Cámara;2025-02-20;20:00:00+01:00;https://www.auditorionacional.mcu.es/es/programacion/cndm-alfredo-rodriguez-trio-coral-way;"
Alfredo Rodríguez Trio Alfredo Rodríguez, piano y voz Michael Olivera, batería Yarel Hernández, bajo eléctrico ""Coral Way""";36, 27 y 18 €;https://www.auditorionacional.mcu.es/es/programacion/cndm-alfredo-rodriguez-trio-coral-way/@@images/2893772b-6959-4635-9530-fdf4377c718c.jpeg
CNDM. Vilde Frang, Valeriy Sokolov & Lawrence Power;Sala de Cámara;2025-02-21;19:30:00+01:00;https://www.auditorionacional.mcu.es/es/programacion/cndm-vilde-frang-valeriy-sokolov-lawrence-power;Vilde Frang, violín Valeriy Sokolov, violín Lawrence Power, viola Eugène Ysaÿe (1858-1931) Sonata para dos violines en la menor (1915) Bjarne Brustad (1895-1978) Capricci, para violín y viola (1931) Zoltán Kodály (1882-1967) Serenata para dos violines y viola, op. 12 (1919-1920);28, 21 y 14 €;https://www.auditorionacional.mcu.es/es/programacion/cndm-vilde-frang-valeriy-sokolov-lawrence-power/@@images/328ada97-059a-4168-b319-082705cade4d.jpeg
OCNE. Sinfónico 15;Sala Sinfónica;2025-02-21;19:30:00+01:00;https://www.auditorionacional.mcu.es/es/programacion/concierto-ocne-sinfonico-15-1;Orquesta Nacional de España Joshua Weilerstein Director Saioa Hernández Soprano Manuel Martínez Burgos Gramática de la niebla * Richard Strauss Seis lieder orquestales (selección de los op. 10 y op. 27) Johannes Brahms Sinfonía núm. 1 en Do menor, op. 68 * Estreno absoluto. Obra encargo de la Orquesta y Coro Nacionales de España;40, 36, 28, 20 y 13 €;https://www.auditorionacional.mcu.es/es/programacion/concierto-ocne-sinfonico-15-1/@@images/d83ef2ef-233e-4445-b7b1-bc1e74baf48a.jpeg
OCNE. Sinfónico 15;Sala Sinfónica;2025-02-22;19:30:00+01:00;https://www.auditorionacional.mcu.es/es/programacion/concierto-ocne-sinfonico-15-1;Orquesta Nacional de España Joshua Weilerstein Director Saioa Hernández Soprano Manuel Martínez Burgos Gramática de la niebla * Richard Strauss Seis lieder orquestales (selección de los op. 10 y op. 27) Johannes Brahms Sinfonía núm. 1 en Do menor, op. 68 * Estreno absoluto. Obra encargo de la Orquesta y Coro Nacionales de España;40, 36, 28, 20 y 13 €;https://www.auditorionacional.mcu.es/es/programacion/concierto-ocne-sinfonico-15-1/@@images/d83ef2ef-233e-4445-b7b1-bc1e74baf48a.jpeg
CNDM. Bill Laurance & Michael League;Sala de Cámara;2025-02-22;19:30:00+01:00;https://www.auditorionacional.mcu.es/es/programacion/cndm-bill-laurance-michael-league;"
Bill Laurance, piano Michael League, bajo y otros instrumentos ""Keeping Company""";36, 27 y 18 €;https://www.auditorionacional.mcu.es/es/programacion/cndm-bill-laurance-michael-league/@@images/6e300acd-d32b-40d4-ab4a-05c6527d88cd.jpeg
UPM. Aromas Románticos;Sala Sinfónica;2025-02-22;22:30:00+01:00;https://www.auditorionacional.mcu.es/es/programacion/upm-aromas-romanticos;"ORQUESTA SINFÓNICA UPM Director: Pablo Puga Raquel Areal, Violín Iago Domínguez, Violonchelo
PROGRAMA
Parte I G. Fauré Pavana, op. 50 J. Brahms Doble concierto de chelo y violín en La menor, op. 102 Parte II L.v. Beethoven Sinfonía nº 7 en La mayor, op. 92";35, 29, 21 y  9'50 €;https://www.auditorionacional.mcu.es/es/programacion/upm-aromas-romanticos/@@images/1d582009-74a1-4053-8f70-628841cbd92b.jpeg
OCNE. Sinfónico 15;Sala Sinfónica;2025-02-23;11:30:00+01:00;https://www.auditorionacional.mcu.es/es/programacion/concierto-ocne-sinfonico-15-1;Orquesta Nacional de España Joshua Weilerstein Director Saioa Hernández Soprano Manuel Martínez Burgos Gramática de la niebla * Richard Strauss Seis lieder orquestales (selección de los op. 10 y op. 27) Johannes Brahms Sinfonía núm. 1 en Do menor, op. 68 * Estreno absoluto. Obra encargo de la Orquesta y Coro Nacionales de España;40, 36, 28, 20 y 13 €;https://www.auditorionacional.mcu.es/es/programacion/concierto-ocne-sinfonico-15-1/@@images/d83ef2ef-233e-4445-b7b1-bc1e74baf48a.jpeg
Fundación Scherzo. Grigory Sokolov;Sala Sinfónica;2025-02-24;19:30:00+01:00;https://www.auditorionacional.mcu.es/es/programacion/fundacion-scherzo-grigory-sokolov-8;"
Grigory Sokolov, piano

Programa por determinar";75, 60, 45 y 32 €;https://www.auditorionacional.mcu.es/es/programacion/fundacion-scherzo-grigory-sokolov-8/@@images/18634488-69da-4a28-b1c8-1183503239db.jpeg
OCNE. Satélite 14.  Cielo y Tierra;Sala de Cámara;2025-02-25;19:30:00+01:00;https://www.auditorionacional.mcu.es/es/programacion/ocne-satelite-14-cielo-y-tierr;"Coro Nacional de España Mireia Barrera Directora
Obras de Aaron Copland, Leonard Bernstein, Benjamin Britten, Lili Boulanger, Alfred Schnittke y Bernat Vivancos";12 €;https://www.auditorionacional.mcu.es/es/programacion/ocne-satelite-14-cielo-y-tierr/@@images/77e953b8-7dc6-45d2-8d46-1ffa1359cdf2.jpeg
Ibermúsica. Gewandhausorchester Leipzig;Sala Sinfónica;2025-02-25;19:30:00+01:00;https://www.auditorionacional.mcu.es/es/programacion/ibermusica-gewandhausorchester-leipzig-2;"Gewandhausorchester Leipzig Andris Nelsons, director Christiane Karg, soprano
Programa Dvo?ák La rueca de oro op. 109 Mahler Sinfonía núm. 4 en Sol Mayor";194, 161, 146, 130, 80, 70 y 45 €;https://www.auditorionacional.mcu.es/es/programacion/ibermusica-gewandhausorchester-leipzig-2/@@images/043e281a-15a4-4055-83d8-6dadcd6e7922.jpeg
Ibermúsica. Gewandhausorchester Leipzig;Sala Sinfónica;2025-02-26;19:30:00+01:00;https://www.auditorionacional.mcu.es/es/programacion/ibermusica-gewandhausorchester-leipzig-3;Gewandhausorchester Leipzig Andris Nelsons, dirección Lucas Jussen, piano Arthur Jussen, piano Mahler Blumine (de la Sinfonía núm. 1) Mendelssohn Concierto 2 pianos Mi Mayor Dvo?ák Sinfonía núm. 8;194, 161, 146, 130, 80, 70 y 45 €;https://www.auditorionacional.mcu.es/es/programacion/ibermusica-gewandhausorchester-leipzig-3/@@images/d1a50ebd-9472-491c-b7d4-aca1736f3885.jpeg
La Filarmónica. Quinta de Chaikovski;Sala Sinfónica;2025-02-27;19:30:00+01:00;https://www.auditorionacional.mcu.es/es/programacion/la-filarmonica-quinta-de-chaikovski;Orquesta Sinfónica WDR Colonia Pablo Ferrández, violonchelo Andrés Orozco-Estrada, director L. v. Beethoven Obertura Egmont R. Schumann Concierto para violonchelo en la menor, Op. 129 P. I. Chaikovski Sinfonía núm. 5 en mi menor, Op. 64;138, 112, 84, 75, 66, 56, 45 y 40 €;https://www.auditorionacional.mcu.es/es/programacion/la-filarmonica-quinta-de-chaikovski/@@images/9443655e-639f-483a-8b57-0cfeb18d1d0b.jpeg
Excelentia. Piazzolla y una noche de Tangos;Sala de Cámara;2025-02-28;19:30:00+01:00;https://www.auditorionacional.mcu.es/es/programacion/excelentia-piazzolla-y-una-noche-de-tangos;"Délica Chamber Orchestra
Una selección de obras de Piazzola: Primavera porteña, Adiós Nonino, Libertango, y tangos como: El día que me quieras, Volver, Caminito, entre otros.";65 y 58 €;https://www.auditorionacional.mcu.es/es/programacion/excelentia-piazzolla-y-una-noche-de-tangos/@@images/6cdf4a0e-3fcf-4b18-aa02-ceb2cefb0b01.jpeg
UAM. Anna Fedorova y Orquesta Sinfónica de Castilla y León;Sala Sinfónica;2025-02-28;19:30:00+01:00;https://www.auditorionacional.mcu.es/es/programacion/uam-anna-fedorova-y-orquesta-sinfonica-de-castilla-y-leon;"Orquesta Sinfónica de Castilla y León Pablo González, director Anna Fedorova, piano
Rosa María Ascot Cielo Bajo
Maurice Rave Concierto para piano y orquesta en Sol mayor
Robert Schumann Sinfonía n.º 4 en Re menor, Op. 120";47, 35, 30, 25, 20 y 15 €;https://www.auditorionacional.mcu.es/es/programacion/uam-anna-fedorova-y-orquesta-sinfonica-de-castilla-y-leon/@@images/4c25bddf-1a5f-43e1-bd6a-9f010641afbc.jpeg
Filarmonía de Madrid. Brahms y Beethoven;Sala Sinfónica;2025-03-01;19:30:00+01:00;https://www.auditorionacional.mcu.es/es/programacion/filarmonia-de-madrid-brahms-y-beethoven;Orquesta y Coro Filarmonía Participativos Filarmonía Rafael Albiñana, director de Coro Pascual Osa, director musical I PARTE Concierto nº5 para piano y orquesta, ‘Emperador’ (L. V. Beethoven) II PARTE Nänie Op. 82 (J. Brahms) Canción del destino, Schicksalslied, Op. 54 (J. Brahms);56, 49, 41, 32 y 28 €;https://www.auditorionacional.mcu.es/es/programacion/filarmonia-de-madrid-brahms-y-beethoven/@@images/0e7ad7ba-0d55-4b59-b7b6-8a84e1b0142b.png
AEMBOES / Madrid Sinfónica Décimo Arte. Romeo y Julieta;Sala de Cámara;2025-03-01;19:30:00+01:00;https://www.auditorionacional.mcu.es/es/programacion/aemboes-madrid-sinfonica-decimo-arte-romeo-y-julieta;Madrid Sinfónica Décimo Arte Director: Alberto G. López I PROKOFIEV (1891-1953) Romeo y Julieta, Suite núm. 2, op.64 II BARBER (1910-1981) Adagio para cuerdas ELGAR (1857-1934) Salut d'amour, Op.12 MASCAGNI (1863-1945) Cavalleria Rusticana, intermezzo MAHLER (1860-1911) Adagietto de la Sinfonía núm. 5 en do sostenido menor WAGNER (1813-1883) Tristan und Isolde Vorspiel und Liebestod;38, 35, 33, 29 y 25 €;https://www.auditorionacional.mcu.es/es/programacion/aemboes-madrid-sinfonica-decimo-arte-romeo-y-julieta/@@images/0e34686b-0e2c-46e4-932f-a528f700187f.jpeg
Fundación Scherzo. Maria João Pires & Ignasi Cambra;Sala Sinfónica;2025-03-02;19:30:00+01:00;https://www.auditorionacional.mcu.es/es/programacion/fundacion-scherzo-maria-joao-pires-ignasi-cambra;Maria João Pires, piano Ignasi Cambra, piano Programa por determinar;75, 60, 45 y 32 €;https://www.auditorionacional.mcu.es/es/programacion/fundacion-scherzo-maria-joao-pires-ignasi-cambra/@@images/4e2c72b6-720f-4485-be3b-6867d086a095.jpeg
Ibermúsica. Evgeny Kissin;Sala Sinfónica;2025-03-03;19:30:00+01:00;https://www.auditorionacional.mcu.es/es/programacion/ibermusica-evgeny-kissin-5;Evgeny Kissin, piano Programa Bach Partita núm. 2 Do menor BWV826 Chopin Nocturno Sol menor op.15 núm.3 Nocturno núm. 16 Mi bemol Mayor op.55 núm. 2 Scherzo núm.4 en Mi Mayor, op.54 Shostakóvich Sonata núm. 2 si menor, op.61 Preludio y Fuga 8 Fa sostenido menor, op.87 Preludio y Fuga 15 en Re bemol Mayor, op. 87 Preludio y Fuga 24 Re menor, op.87;83, 70, 59, 55, 43, 34 y 20 €;https://www.auditorionacional.mcu.es/es/programacion/ibermusica-evgeny-kissin-5/@@images/3dcac2a2-4f0a-4310-9881-a28ec11e10bc.jpeg
OCNE. Satélite 15. Miradas Olvidadas;Sala de Cámara;2025-03-04;19:30:00+01:00;https://www.auditorionacional.mcu.es/es/programacion/ocne-satelite-15-miradas-olvidadas;"Ad Infinitum Joan Espina Alejandra Navarro Violines Martí Varela Viola Mireia Peñarroja Violonchelo Toni García Araque Contrabajo Jesús Campo Órgano y piano
Ariel Hernández Tenor Francesca Calero Soprano Enrique Sánchez Barítono
Obras de Antonio Reparaz, María de Pablos, María Luisa Güell, Isabel Güell y María Luisa Chevallier";12 €;https://www.auditorionacional.mcu.es/es/programacion/ocne-satelite-15-miradas-olvidadas/@@images/eb227f6c-45af-465b-b147-984d4da7956f.jpeg
Ibermúsica. Filarmonica della Scala;Sala Sinfónica;2025-03-04;19:30:00+01:00;https://www.auditorionacional.mcu.es/es/programacion/ibermusica-filarmonica-della-scala-1;"Filarmonica della Scala Riccardo Chailly, dirección Gautier Capuçon, violonchelo
Dvo?ák Concierto violonchelo Si menor op.104 Berio Quatre dédicaces Prokófiev Romeo y Julieta, suite";194, 161, 146, 130, 80, 70 y 45 €;https://www.auditorionacional.mcu.es/es/programacion/ibermusica-filarmonica-della-scala-1/@@images/be61829f-47fb-410d-9e16-8c4d7dd5091a.jpeg
Orquesta Sinfónica de Madrid. Luis Miguel Méndez;Sala Sinfónica;2025-03-05;19:30:00+01:00;https://www.auditorionacional.mcu.es/es/programacion/orquesta-sinfonica-de-madrid-17;"Orquesta Sinfónica de Madrid Luis Miguel Méndez DIRECTOR

Luigi Boccherini/ Luciano Berio Ritirata notturna di Madrid Ottorino Respighi Feste romane, P 157 Ottorino Respighi Fontane di Roma, P 106 Pini di Roma, P 141";45, 30, 18 y 10 €;https://www.auditorionacional.mcu.es/es/programacion/orquesta-sinfonica-de-madrid-17/@@images/001ce911-b0cb-4dd5-8974-24831a500140.jpeg
"CNDM. Los Elementos: ""Clori, Tirsi e Fileno"" (G. F. Haendel)";Sala de Cámara;2025-03-05;19:30:00+01:00;https://www.auditorionacional.mcu.es/es/programacion/cndm-los-elementos-clori-tirsi-e-fileno-g-g-haendel;"
Los Elementos ROBIN JOHANNSEN, soprano (Tirsi) ANA VIEIRA LEITE, soprano (Clori) ALBERTO MIGUÉLEZ ROUCO, alto (Fileno) y dirección Programa George Frideric Haendel (1685-1759) Clori, Tirsi e Fileno, serenata pastoral a tres voces , HWV 96 (1707)";28, 21 y 14 €;https://www.auditorionacional.mcu.es/es/programacion/cndm-los-elementos-clori-tirsi-e-fileno-g-g-haendel/@@images/0f003919-0e75-45f3-b178-a5faef00444e.jpeg
OCNE. Sinfónico 16;Sala Sinfónica;2025-03-07;19:30:00+01:00;https://www.auditorionacional.mcu.es/es/programacion/concierto-ocne-sinfonico-16-1;Orquesta Nacional de España Cornelius Meister Director Alexandra Dovgan Piano Vera-Lotte Boecker Soprano Raquel García-Tomás Las constelaciones que más brillan Serguéi Rajmáninov Rapsodia sobre un tema de Paganini op. 43 Gustav Mahler Sinfonía núm 4, en Sol mayor [54’];40, 36, 28, 20 y 13 €;https://www.auditorionacional.mcu.es/es/programacion/concierto-ocne-sinfonico-16-1/@@images/599a0f9f-8405-436f-a40c-d9fcbae1d88e.jpeg
Ibermúsica. Los Niños Cantores de Viena;Sala Sinfónica;2025-03-08;11:30:00+01:00;https://www.auditorionacional.mcu.es/es/programacion/ibermusica-los-ninos-cantores-de-viena;"
Los Niños Cantores de Viena Programa Johann Strauss y sus contemporáneos";60, 50, 45, 40, 35, 30 y 15 €;https://www.auditorionacional.mcu.es/es/programacion/ibermusica-los-ninos-cantores-de-viena/@@images/f3d5c93d-3581-41e4-905a-869b5f7f0d9f.jpeg
OCNE. Sinfónico 16;Sala Sinfónica;2025-03-08;19:30:00+01:00;https://www.auditorionacional.mcu.es/es/programacion/concierto-ocne-sinfonico-16-1;Orquesta Nacional de España Cornelius Meister Director Alexandra Dovgan Piano Vera-Lotte Boecker Soprano Raquel García-Tomás Las constelaciones que más brillan Serguéi Rajmáninov Rapsodia sobre un tema de Paganini op. 43 Gustav Mahler Sinfonía núm 4, en Sol mayor [54’];40, 36, 28, 20 y 13 €;https://www.auditorionacional.mcu.es/es/programacion/concierto-ocne-sinfonico-16-1/@@images/599a0f9f-8405-436f-a40c-d9fcbae1d88e.jpeg
"CNDM. L’Arpeggiata: ""Wonder Women""";Sala de Cámara;2025-03-08;19:30:00+01:00;https://www.auditorionacional.mcu.es/es/programacion/cndm-l2019arpeggiata;"L’Arpeggiata Christina Pluhar, tiorba y dirección Luciana Mancini, mezzosoprano Programa ""Wonder Women. Música de y sobre mujeres"" Tradicional de México La bruja (arr. C. Pluhar) Barbara Strozzi (1619-1677) Che si può fare?, de Arie, op. 8, n.º 6 (1664) Tradicional de México La llorona (arr. C. Pluhar) Isabella Leonarda (1620-1704) Nive puer, de Motetti, op. 7, n.º 1 (1677, arr. C. Pluhar) Tradicional de México La lloroncita (arr. C. Pluhar) Maurizio Cazzati (1616-1678) La Strozza, de Sonate a due violini e basso continuo, op. 18, n.º 12 (1656) Antonia Padoani Bembo (1640-1720) Habbi pietà di me, de Produzioni armoniche, n.º 16 (ca. 1700-1701) Francesca Caccini (1587-ca. 1641) ‘Così, perfida Alcina’, de La liberazione di Ruggiero dall’isola di Alcina (1625) Andrea Falconieri (1585-1656) La Benedetta, de Il primo libro di canzone, sinfonie […], volte, n.º 56 (1650) Henry du Bailly (?-1637) Yo soy la locura (1614, arr. C. Pluhar) B. Strozzi L’amante consolato, de Cantatte, arietti e duetti, op. 2, n.º 6 (1651) Francesca Campana (ca. 1615-d. 1665) È già rotto lo strale, de Arie a una, due e tre voci, op. 1 (1629) M. Cazzati Capriccio sopra sette note (ca. 1651) F. Caccini Lasciatemi qui solo, de Il primo libro delle musiche, n.º 1 (1618)";36, 27 y 18 €;https://www.auditorionacional.mcu.es/es/programacion/cndm-l2019arpeggiata/@@images/1796000e-3dd9-40de-89e8-d8856f14bab9.jpeg
OCNE. Sinfónico 16;Sala Sinfónica;2025-03-09;11:30:00+01:00;https://www.auditorionacional.mcu.es/es/programacion/concierto-ocne-sinfonico-16-1;Orquesta Nacional de España Cornelius Meister Director Alexandra Dovgan Piano Vera-Lotte Boecker Soprano Raquel García-Tomás Las constelaciones que más brillan Serguéi Rajmáninov Rapsodia sobre un tema de Paganini op. 43 Gustav Mahler Sinfonía núm 4, en Sol mayor [54’];40, 36, 28, 20 y 13 €;https://www.auditorionacional.mcu.es/es/programacion/concierto-ocne-sinfonico-16-1/@@images/599a0f9f-8405-436f-a40c-d9fcbae1d88e.jpeg
CNDM. Balthasar-Neumann-Chor & Orchester;Sala Sinfónica;2025-03-09;19:00:00+01:00;https://www.auditorionacional.mcu.es/es/programacion/cndm-balthasar-neumann-chor-orchester;BALTHASAR-NEUMANN-CHOR & ORCHESTER THOMAS HENGELBROCK, director REGULA MÜHLEMANN, soprano EVA ZAÏCIK, mezzosoprano JULIAN PRÉGARDIEN, tenor GABRIEL ROLLINSON, bajo Ludwig van Beethoven (1770-1827) Missa solemnis, op. 123 (1819-1823);50, 40, 32, 24 y 18 €;https://www.auditorionacional.mcu.es/es/programacion/cndm-balthasar-neumann-chor-orchester/@@images/8c7b96da-99d2-4dec-ae43-d4b3ef557b38.jpeg
Filarmonía de Madrid. Broadway en Concierto: Un Musical de Musicales 3;Sala Sinfónica;2025-03-11;19:30:00+01:00;https://www.auditorionacional.mcu.es/es/programacion/filarmonia-de-madrid-broadway-en-concierto-un-musical-de-musicales-3;"Orquesta, Coro y Ballet Filarmonía Participativos Filarmonía Rafael Albiñana, director de Coro Pascual Osa, director musical Eva Diago, directora artística ""Broadway en concierto. Un Musical de Musicales 3"" Selección de fragmentos de los musicales de Broadway";56, 49, 41, 32 y 28 €;https://www.auditorionacional.mcu.es/es/programacion/filarmonia-de-madrid-broadway-en-concierto-un-musical-de-musicales-3/@@images/6c7acb5c-eb4b-4c5e-b5c2-0a1cc51ab43c.png
CNDM. José Valencia;Sala de Cámara;2025-03-14;19:30:00+01:00;https://www.auditorionacional.mcu.es/es/programacion/cndm-jose-valencia;"José Valencia, cantaor Juan Requena, guitarra Manuel Valencia, palmas Juan Diego Valencia, palmas ""Mi camino""";36, 27 y 18 €;https://www.auditorionacional.mcu.es/es/programacion/cndm-jose-valencia/@@images/fe20474a-8c0f-4bf9-9f63-6ea6b4073241.jpeg
Grupo Concertante Talía. Ciclo Sinfónico-Coral. Fauré, Saint-Saëns, Poulenc;Sala Sinfónica;2025-03-14;19:30:00+01:00;https://www.auditorionacional.mcu.es/es/programacion/grupo-concertante-talia-ciclo-sinfonico-coral-faure-saint-saens-poulenc;"
Orquesta Metropolitana de Madrid Coro Talía Guillem Gràcia, violonchelo Directora titular: Silvia Sanz Torre

Gabriel Fauré (1845-1924) Pavana en fa sostenido menor, op. 50
Camille Saint-Saëns (1835--1921) Concierto para violonchelo n.º 1 en la menor, op. 33
Francis Poulenc (1899-1963) Stabat Mater";38, 34, 28 y 19 €;https://www.auditorionacional.mcu.es/es/programacion/grupo-concertante-talia-ciclo-sinfonico-coral-faure-saint-saens-poulenc/@@images/f18e2449-a499-4b69-a03a-df71703f028a.jpeg
CNDM. Nathan Laube;Sala Sinfónica;2025-03-15;12:30:00+01:00;https://www.auditorionacional.mcu.es/es/programacion/cndm-nathan-laube;Nathan Laube, órgano Programa Johann Sebastian Bach (1685-1750) Passacaglia en do menor, BWV 582 (ca. 1708-1712 ) Dies sind die heiligen zehn Gebot, BWV 678, de Clavier U?bung III (1739) Franz Liszt (1811-1886) Sonata para piano en si menor, S 178 (1852-1853, arr. N. Laube);6 €;https://www.auditorionacional.mcu.es/es/programacion/cndm-nathan-laube/@@images/fb61f957-319b-419e-b8c8-0528d0f0b0d8.jpeg
UPM. Eterna Armonía;Sala Sinfónica;2025-03-15;18:00:00+01:00;https://www.auditorionacional.mcu.es/es/programacion/upm-eterna-armonia;ORQUESTA FILARMÓNICA ESPAÑOLA Director: Javier Corcuera Martínez CORO DE LA UNIVERSIDAD POLITÉCNICA DE MADRID Arantza Ezenarro, Soprano Marina Pardo, Contralto Francisco Díaz-Carrillo, Tenor Víctor Cruz, Barítono PROGRAMA J.S. Bach Pasión según San Juan, BWV 245;35, 29, 21 y  9'50 €;https://www.auditorionacional.mcu.es/es/programacion/upm-eterna-armonia/@@images/174db40e-0594-4aaa-b27d-4c7318be68fe.jpeg
CNDM. Caminero Quinteto;Sala de Cámara;2025-03-15;20:00:00+01:00;https://www.auditorionacional.mcu.es/es/programacion/cndm-caminero-quinteto-1;Caminero Quinteto Pablo Martín Caminero, contrabajo Daniel Juárez, saxo tenor Pablo Martínez, trombón Álex Conde, piano Borja Barrueta, batería Programa Pablo Martín Caminero (1974) 51 *+ (2024-2025) *+ Estreno absoluto. Encargo del CNDM;36, 27 y 18 €;https://www.auditorionacional.mcu.es/es/programacion/cndm-caminero-quinteto-1/@@images/5853c94f-4e86-4625-b145-ae8ffe5c416c.jpeg
OCNE. Descubre 03;Sala Sinfónica;2025-03-16;11:30:00+01:00;https://www.auditorionacional.mcu.es/es/programacion/ocne-descubre-03;"
Orquesta y Coro Nacionales de España Juanjo Guillem, Rafael Gálvez, Antonio Martín, percusión Iván López Reynoso, director
Israel López Estelche Naturaleza muerta * Robert Schumann Sinfonía núm. 4, en Re menor, op. 120 * Estreno absoluto. Obra encargo de la Orquesta y Coro Nacionales de España";28, 24, 20 y 16 €;https://www.auditorionacional.mcu.es/es/programacion/ocne-descubre-03/@@images/25f7d211-f5e2-476d-a79b-270ec81508b6.jpeg
Orquesta Camerata Musicalis. Mucho Más que un Concierto. Schubert;Sala de Cámara;2025-03-16;11:30:00+01:00;https://www.auditorionacional.mcu.es/es/programacion/orquesta-camerata-musicalis-mucho-mas-que-un-concierto-schubert;"
Orquesta Camerata Musicalis Edgar Martín Jiménez, director
F. Schubert Quinteto D.667 «La Trucha»";37’50,  29’50,  23’50 y  18’50 €;https://www.auditorionacional.mcu.es/es/programacion/orquesta-camerata-musicalis-mucho-mas-que-un-concierto-schubert/@@images/b526f892-a567-4bfc-93c2-04603696ad75.jpeg
OCNE. Satélite 16. La Cuarta de Mahler;Sala de Cámara;2025-03-17;19:30:00+01:00;https://www.auditorionacional.mcu.es/es/programacion/ocne-satelite-16-la-cuarta-de-mahler;"IL Maniático Ensemble Margarita Rodríguez Soprano Ane Matxain Mario Pérez Violín Alicia Salas Viola Josep Trescolí Violonchelo Laura Asensio Contrabajo Coline-Marie Orliac Arpa Álvaro Octavio Flauta Robert Silla Oboe Eduardo Raimundo Clarinete Enrique Abargues Fagot Pedro Jorge Trompa Manuel Blanco Trompeta Jordi Navarro Trombón Joan Castelló Antonio Martín Percusión
Gustav Mahler Sinfónía nº 4 en Sol Mayor (versión de cámara de Iain Farrington)";12 €;https://www.auditorionacional.mcu.es/es/programacion/ocne-satelite-16-la-cuarta-de-mahler/@@images/46884faa-5bed-4404-b4ff-6c3d998307f9.jpeg
ORCAM. Sinfónico VII. No Solo Música;Sala Sinfónica;2025-03-17;19:30:00+01:00;https://www.auditorionacional.mcu.es/es/programacion/orcam-sinfonico-vii-no-solo-musica;"

Orquesta de la Comunidad de Madrid Edicson Ruiz, CONTRABAJO Christian Vásquez, DIRECTOR
Efrain Oscher Concierto para contrabajo y orquesta +
Piotr Ilich Tchaikovsky Sinfonía nº4 en fa menor, op. 36
+ Primera vez ORCAM";36, 28, 23 y 15 €;https://www.auditorionacional.mcu.es/es/programacion/orcam-sinfonico-vii-no-solo-musica/@@images/c235309b-7b97-4119-b67c-cc7d4e5ba4b1.jpeg
Ibermúsica. Ana María Alonso y Rubén Yessayan;Sala de Cámara;2025-03-19;19:30:00+01:00;https://www.auditorionacional.mcu.es/es/programacion/ibermusica-ana-maria-alonso-y-ruben-yessayan;Ana María Alonso, viola Rubén Yessayan, piano;No disponible;https://www.auditorionacional.mcu.es/es/programacion/ibermusica-ana-maria-alonso-y-ruben-yessayan/@@images/525bd54c-aec7-4da9-a6a6-bf02060fdbfb.jpeg
CNDM. Liza Ferschtman, Malin Broman, Antoine Lederlin & Jonathan Biss;Sala de Cámara;2025-03-20;19:30:00+01:00;https://www.auditorionacional.mcu.es/es/programacion/cndm-liza-ferschtman-malin-broman-antoine-lederlin-jonathan-biss;Liza Ferschtman, violín Malin Broman, viola Antoine Lederlin, violonchelo Jonathan Biss, piano Antonín Dvo?ák (1841-1904) Cuarteto para piano y cuerda n.º 1 en re mayor, op. 23 (1875) Leoš Janá?ek (1854-1928) Sonata para violín y piano (1922) Fanny Hensel-Mendelssohn (1805-1847) Selección de cuatro lieder (arr. para viola y piano) Johannes Brahms (1833-1897) Cuarteto para piano y cuerda n.º 3 en do menor, op. 60 (1855-1875);28, 21 y 14 €;https://www.auditorionacional.mcu.es/es/programacion/cndm-liza-ferschtman-malin-broman-antoine-lederlin-jonathan-biss/@@images/c55d647f-adfe-45c5-8ab9-c64c83fff7e1.jpeg
Excelentia. Bach, Pasión según San Mateo;Sala Sinfónica;2025-03-20;19:30:00+01:00;https://www.auditorionacional.mcu.es/es/programacion/excelentia-bach-pasion-segun-san-mateo;"Sociedad Coral Excelentia de Madrid
Orquesta Clásica Santa Cecilia
Alexander Znamensky, director
J. S. Bach La Pasión según San Mateo";78, 74, 72, 68, 56, 52, 48 y 42 €;https://www.auditorionacional.mcu.es/es/programacion/excelentia-bach-pasion-segun-san-mateo/@@images/e1f44db8-2166-4de6-89c9-364a6daa9666.jpeg
